[
  {"id":"vrchat-ask-rss","name":"VRChat Ask latest RSS","canonical_url":"https://ask.vrchat.com/latest","fetch_url":"https://ask.vrchat.com/latest.rss","source_family":"VRChat Ask Forum","source_class":"community","content_type":"forum","fetch_mode":"rss","enabled":true,"year_scope":["2026"],"languages":["en"],"repository":"unknown","last_verified_date":"2026-08-16","access_note":"Public Discourse RSS endpoint; community observations are not promoted to official root causes without corroboration."},
  {"id":"zenn-vr-rss","name":"Zenn VR topic RSS","canonical_url":"https://zenn.dev/topics/vr","fetch_url":"https://zenn.dev/topics/vr/feed","source_family":"Zenn","source_class":"article","content_type":"article","fetch_mode":"rss","enabled":true,"year_scope":["2026"],"languages":["ja"],"repository":"unknown","last_verified_date":"2026-08-16","access_note":"Public topic feed; retain only VRChat/Unity failure-relevant 2026 articles and canonical article URLs."},
  {"id":"qiita-unity-rss","name":"Qiita Unity tag RSS","canonical_url":"https://qiita.com/tags/unity","fetch_url":"https://qiita.com/tags/unity/feed","source_family":"Qiita","source_class":"article","content_type":"article","fetch_mode":"rss","enabled":true,"year_scope":["2026"],"languages":["ja"],"repository":"unknown","last_verified_date":"2026-08-16","access_note":"Public tag feed; filter for VRChat-specific 2026 failure articles before canonical adoption."},
  {"id":"note-sitemap","name":"note sitemap index","canonical_url":"https://note.com/sitemap.xml.gz","fetch_url":"https://note.com/sitemap.xml.gz","source_family":"note","source_class":"article","content_type":"article","fetch_mode":"sitemap","enabled":true,"year_scope":["2026"],"languages":["ja"],"repository":"unknown","last_verified_date":"2026-08-18","access_note":"Public sitemap index used only for bounded discovery; 2026 VRChat failure candidates are verified against canonical note.com article pages before raw adoption. Do not crawl the entire platform or store article bodies."},
  {"id":"yu-suzumi-ma-inspector","name":"Yu Suzumi Modular Avatar Inspector field report","canonical_url":"https://blog.yu-suz.com/archives/8258","fetch_url":"https://blog.yu-suz.com/archives/8258","source_family":"Yu Suzumi blog","source_class":"article","content_type":"article","fetch_mode":"manual_url","enabled":false,"year_scope":["2026"],"languages":["ja"],"repository":"unknown","last_verified_date":"2026-08-18","access_note":"Canonical record is retained, but scheduled retrieval is disabled because automated fetch returned an interstitial instead of the article on 2026-08-18. Keep this as manual URL evidence; do not bypass the site's access control."},
  {"id":"vrcmods-sdk3-error-guide","name":"VRCMods SDK3 Error Mega Guide","canonical_url":"https://vrcmods.com/blog/how-to-fix-vrchat-avatar-errors-in-unity-sdk3-error-mega-guide","fetch_url":"https://vrcmods.com/blog/how-to-fix-vrchat-avatar-errors-in-unity-sdk3-error-mega-guide","source_family":"VRCMods","source_class":"article","content_type":"article","fetch_mode":"manual_url","enabled":true,"year_scope":["2026"],"languages":["en"],"repository":"unknown","last_verified_date":"2026-08-16","access_note":"Community troubleshooting guide; use as discovery/supporting evidence, not authoritative root-cause evidence."}
]
