[
  {"id":"unity-release-6000-3-3f1","name":"Unity 6000.3.3f1 Release Notes","canonical_url":"https://unity.com/releases/editor/whats-new/6000.3.3f1","fetch_url":"https://unity.com/releases/editor/whats-new/6000.3.3f1","source_family":"Unity Release Notes","source_class":"official","content_type":"release","fetch_mode":"html","enabled":true,"year_scope":["2026"],"languages":["en"],"repository":"unknown","last_verified_date":"2026-08-18","access_note":"Public official Unity release notes; retain only failure-relevant facts, versions, UUM identifiers, and canonical source URLs."},
  {"id":"unity-release-6000-3-11f1","name":"Unity 6000.3.11f1 Release Notes","canonical_url":"https://unity.com/releases/editor/whats-new/6000.3.11f1","fetch_url":"https://unity.com/releases/editor/whats-new/6000.3.11f1","source_family":"Unity Release Notes","source_class":"official","content_type":"release","fetch_mode":"html","enabled":true,"year_scope":["2026"],"languages":["en"],"repository":"unknown","last_verified_date":"2026-08-18","access_note":"Public official Unity release notes; retain only failure-relevant facts, versions, UUM identifiers, and canonical source URLs."},
  {"id":"unity-release-6000-3-12f1","name":"Unity 6000.3.12f1 Release Notes","canonical_url":"https://unity.com/releases/editor/whats-new/6000.3.12f1","fetch_url":"https://unity.com/releases/editor/whats-new/6000.3.12f1","source_family":"Unity Release Notes","source_class":"official","content_type":"release","fetch_mode":"html","enabled":true,"year_scope":["2026"],"languages":["en"],"repository":"unknown","last_verified_date":"2026-08-18","access_note":"Public official Unity release notes; retain only failure-relevant facts, versions, UUM identifiers, and canonical source URLs."},
  {"id":"unity-release-6000-3-15f1","name":"Unity 6000.3.15f1 Release Notes","canonical_url":"https://unity.com/releases/editor/whats-new/6000.3.15f1","fetch_url":"https://unity.com/releases/editor/whats-new/6000.3.15f1","source_family":"Unity Release Notes","source_class":"official","content_type":"release","fetch_mode":"html","enabled":true,"year_scope":["2026"],"languages":["en"],"repository":"unknown","last_verified_date":"2026-08-18","access_note":"Public official Unity release notes; retain only failure-relevant facts, versions, UUM identifiers, and canonical source URLs."},
  {"id":"unity-release-6000-3-17f1","name":"Unity 6000.3.17f1 Release Notes","canonical_url":"https://unity.com/releases/editor/whats-new/6000.3.17f1","fetch_url":"https://unity.com/releases/editor/whats-new/6000.3.17f1","source_family":"Unity Release Notes","source_class":"official","content_type":"release","fetch_mode":"html","enabled":true,"year_scope":["2026"],"languages":["en"],"repository":"unknown","last_verified_date":"2026-08-18","access_note":"Public official Unity release notes; retain only failure-relevant facts, versions, UUM identifiers, and canonical source URLs."},
  {"id":"unity-release-6000-5-5f1","name":"Unity 6000.5.5f1 Release Notes","canonical_url":"https://unity.com/releases/editor/whats-new/6000.5.5f1","fetch_url":"https://unity.com/releases/editor/whats-new/6000.5.5f1","source_family":"Unity Release Notes","source_class":"official","content_type":"release","fetch_mode":"html","enabled":true,"year_scope":["2026"],"languages":["en"],"repository":"unknown","last_verified_date":"2026-08-18","access_note":"Public official Unity release notes; retain only failure-relevant facts, versions, UUM identifiers, and canonical source URLs."},
  {"id":"unity-release-6000-5-6f1","name":"Unity 6000.5.6f1 Release Notes","canonical_url":"https://unity.com/releases/editor/whats-new/6000.5.6f1","fetch_url":"https://unity.com/releases/editor/whats-new/6000.5.6f1","source_family":"Unity Release Notes","source_class":"official","content_type":"release","fetch_mode":"html","enabled":true,"year_scope":["2026"],"languages":["en"],"repository":"unknown","last_verified_date":"2026-08-18","access_note":"Public official Unity release notes; retain only failure-relevant facts, versions, UUM identifiers, and canonical source URLs."}
]
